{
  "contract_id": "analytics-ui-observability-hardening-review",
  "contract_version": "0.1.0",
  "governed_by_rfc": "RFC-0108",
  "lifecycle_status": "second-last-hardening-implemented",
  "review_scope": [
    {
      "area": "telemetry fields",
      "status": "passed",
      "evidence": "All implemented metrics, browser events, gateway logs, audit logs, trace attributes, attention attributes, and audit attributes are validated against analytics-ui-observability-contract allowed labels and forbidden fields."
    },
    {
      "area": "panel states",
      "status": "passed",
      "evidence": "Certified Workbench route groups are validated against workbench-panel-registry and rollout readiness; performance analysis, evidence, advisor-book, and report-centre routes remain certified_partial with explicit residual scope."
    },
    {
      "area": "api and swagger certification",
      "status": "passed",
      "evidence": "RFC-0108 did not add a new Gateway or backend HTTP API shape requiring new OpenAPI operations. Existing Gateway Workbench analytics APIs remain covered by repo contract tests; Workbench /api/metrics is an internal Prometheus text endpoint outside OpenAPI schema."
    },
    {
      "area": "dashboard and alerts",
      "status": "passed",
      "evidence": "Platform dashboard and alert tests validate implemented-metric-only references, forbidden annotation exclusion, and runbook links."
    },
    {
      "area": "residual unsupported scope",
      "status": "planned_residual",
      "evidence": "Historical pre-ecosystem hardening snapshot: backend freshness/supportability, full caller-context entitlement certification, all-UI Gateway fan-out rollout, and broad Workbench rollout were planned at that time. Current ecosystem contracts supersede this with performance/risk supportability implemented in domain services, consumed by Gateway PR #166, and consumed by Workbench PR #118 for supported reads, while full promotion still requires clean governed canonical runtime proof."
    }
  ],
  "telemetry_field_review": {
    "source_contract": "analytics-ui-observability-contract",
    "allowed_label_policy": "contract_only",
    "forbidden_field_policy": "deny_all_forbidden_fields",
    "runtime_events_reviewed": [
      "workbench.analytics.panel_hydration",
      "workbench.analytics.panel_state",
      "workbench.analytics.api_request",
      "workbench.analytics.attention",
      "gateway.analytics.fanout.completed",
      "gateway.analytics.fanout.degraded",
      "gateway.analytics.audit.analytics_read_allowed",
      "gateway.analytics.audit.analytics_read_denied"
    ]
  },
  "panel_state_review": {
    "source_contract": "analytics-ui-observability-contract",
    "source_registry": "workbench-panel-registry",
    "certified_route_groups_reviewed": [
      "/book?asOfDate={canonicalAsOfDate}",
      "/portfolio?portfolioId={portfolio_id}",
      "/portfolio?portfolioId={portfolio_id}&tab=detailed",
      "/reports?portfolioId={portfolio_id}",
      "/performance?portfolioId={portfolio_id}",
      "/performance?portfolioId={portfolio_id}&mode=analysis",
      "/performance?portfolioId={portfolio_id}&mode=advisor",
      "/performance?portfolioId={portfolio_id}&mode=risk",
      "/performance?portfolioId={portfolio_id}&mode=evidence",
      "/workbench/{portfolio_id}",
      "/workbench/{portfolio_id}?mode=construction",
      "/workbench/{portfolio_id}?mode=quality",
      "/workbench/{portfolio_id}?mode=copilot",
      "/proposals/{proposalId}",
      "/recommendations?portfolioId={portfolio_id}&mode=cockpit",
      "/recommendations?portfolioId={portfolio_id}&mode=copilot",
      "/recommendations?portfolioId={portfolio_id}&mode=proof"
    ],
    "non_telemetry_registry_states": ["unavailable"]
  },
  "api_certification_review": [
    {
      "surface": "Workbench /api/metrics Prometheus text endpoint",
      "owner_repo": "lotus-workbench",
      "changed_by_rfc0108": true,
      "openapi_required": false,
      "certification_status": "certified",
      "evidence": "Metrics route unit tests prove product-safe Prometheus output for implemented analytics UI metric families; platform scrape config points at this endpoint."
    },
    {
      "surface": "Gateway selected Workbench analytics reads",
      "owner_repo": "lotus-gateway",
      "changed_by_rfc0108": false,
      "openapi_required": true,
      "certification_status": "certified",
      "evidence": "RFC-0108 added correlation, structured log, and audit behavior around existing API shapes. Existing Gateway contract tests cover Workbench analytics OpenAPI registration, descriptions, examples, and product-safe schemas."
    },
    {
      "surface": "Gateway analytics fan-out metrics",
      "owner_repo": "lotus-gateway",
      "changed_by_rfc0108": false,
      "openapi_required": false,
      "certification_status": "planned_residual",
      "evidence": "Fan-out metrics are intentionally planned; no dashboard or alert may reference them until implemented and certified."
    },
    {
      "surface": "Backend analytics freshness and supportability metrics",
      "owner_repo": "lotus-performance/lotus-risk",
      "changed_by_rfc0108": false,
      "openapi_required": false,
      "certification_status": "planned_residual",
      "evidence": "Historical pre-ecosystem review: backend freshness/supportability metric emission was planned at that time. Current ecosystem contracts record performance/risk source supportability, Gateway PR #166 consumption, and Workbench PR #118 source_supportability consumption for supported reads; Workbench freshness support still requires clean governed canonical runtime proof before promotion."
    }
  ],
  "dashboard_certification_review": {
    "dashboard_id": "analytics-ui-observability-overview",
    "alert_ids": [
      "analytics-ui-panel-error-rate",
      "analytics-ui-api-request-latency-p95",
      "analytics-ui-attention-events",
      "analytics-ui-panel-hydration-latency-p95",
      "gateway-analytics-fanout-latency-p95",
      "gateway-analytics-degraded-sources",
      "backend-analytics-freshness-action-required",
      "ai-surface-supportability-degraded"
    ],
    "implemented_metrics_only": true,
    "runbook_paths_required": true
  },
  "enterprise_governance_review": {
    "supported_features_policy": "implementation_backed_only",
    "sensitive_content_policy": "no_sensitive_content",
    "mesh_standards_posture": "no_new_domain_product_or_mesh_api"
  },
  "findings": [
    {
      "finding_id": "RFC0108-HARDENING-001",
      "severity": "P2",
      "status": "closed",
      "summary": "Slice 9 rollout readiness needed to be tied to supported-feature residual scope.",
      "evidence": "analytics-ui-observability-rollout-readiness validator now requires residual feature keys to remain planned in supported features."
    },
    {
      "finding_id": "RFC0108-HARDENING-002",
      "severity": "P2",
      "status": "closed",
      "summary": "Second-last review needed executable proof that no dashboard, alert, or telemetry field overclaims unsupported metrics or sensitive fields.",
      "evidence": "Hardening review validator consumes the observability contract, rollout readiness contract, dashboard, alert rules, and panel registry."
    },
    {
      "finding_id": "RFC0108-HARDENING-003",
      "severity": "P3",
      "status": "planned_residual",
      "summary": "Workbench source_supportability reconciliation is implemented for supported performance/risk reads; full Workbench promotion remains planned after later backend and Gateway supportability work.",
      "evidence": "Gateway fan-out metrics are implementation-backed through Slice 13; backend residual scope remains in analytics-ui-observability-rollout-readiness and supported features with planned status."
    }
  ],
  "residual_scope": [
    {
      "feature_key": "workbench.analytics.observability.freshness_degraded_state",
      "status": "planned",
      "owner_repo": "lotus-workbench/lotus-performance/lotus-risk",
      "reason": "Performance/risk backend freshness and supportability metrics are implemented and consumed by Gateway/Workbench for supported reads; full Workbench promotion still requires complete RFC-0079 risk/evidence and all-supported-surface certification."
    }
  ],
  "required_local_commands": [
    "python automation\\validate_analytics_ui_observability_contract.py",
    "python automation\\validate_analytics_ui_rollout_readiness.py",
    "python automation\\validate_analytics_ui_hardening_review.py",
    "python -m pytest tests\\unit\\test_analytics_ui_observability_contract.py tests\\unit\\test_analytics_ui_rollout_readiness.py tests\\unit\\test_analytics_ui_hardening_review.py tests\\unit\\test_platform_stack_observability_contract.py -q",
    "python -m ruff check automation\\validate_analytics_ui_observability_contract.py automation\\validate_analytics_ui_rollout_readiness.py automation\\validate_analytics_ui_hardening_review.py tests\\unit\\test_analytics_ui_observability_contract.py tests\\unit\\test_analytics_ui_rollout_readiness.py tests\\unit\\test_analytics_ui_hardening_review.py"
  ],
  "required_github_checks": [
    "Cross-App Vocabulary Gate",
    "Feature Lane / Platform Repo Contracts",
    "Feature Lane / Workflow Lint",
    "PR Merge Gate / Platform Repo Contracts",
    "PR Merge Gate / Workflow Lint"
  ]
}
